{
  "Godina": 2024,
  "Događaj": "The Game Awards 2024",
  "Lokacija_događaja": "Peacock Theater, Los Angeles, USA",
  "Voditelj": "Geoff Keighley",
  "Kategorije": [
    {
      "Kategorija": "Best Action Game",
      "Opis": "Nagrada za najbolju igru koja se temelji prvenstveno na borbenom sustavu i akcijskom igranju.",
      "Nominirane_igre": [
        {
          "Naziv_igre": "Black Myth: Wukong",
          "Developer": "Game Science",
          "Izdavač": "Game Science",
          "Zemlja_podrijetla": "China",
          "Platforme": ["PlayStation 5", "Windows", "Xbox Series X/S"],
          "Žanr": ["Action", "Role-playing"],
          "Prosječna_ocjena_(Metacritic)": 90,
          "Pobjednik": true,
          "Napomena": "Akcijski RPG inspiriran kineskom mitologijom s impresivnim tehničkim postignućima."
        },
        {
          "Naziv_igre": "Call of Duty: Black Ops 6",
          "Developer": "Treyarch",
          "Izdavač": "Activision",
          "Zemlja_podrijetla": "USA",
          "Platforme": [
            "PlayStation 4",
            "PlayStation 5",
            "Windows",
            "Xbox One",
            "Xbox Series X/S"
          ],
          "Žanr": ["First-person", "Shooter"],
          "Prosječna_ocjena_(Metacritic)": 83,
          "Pobjednik": false,
          "Napomena": "Nastavak popularnog FPS serijala s fokusom na dinamičnu kampanju i višestruki multiplayer mod."
        },
        {
          "Naziv_igre": "Helldivers II",
          "Developer": "Arrowhead Game Studios",
          "Izdavač": "Sony Interactive Entertainment",
          "Zemlja_podrijetla": "Sweden",
          "Platforme": ["PlayStation 5", "Windows"],
          "Žanr": ["Shooter", "Third-person"],
          "Prosječna_ocjena_(Metacritic)": 86,
          "Pobjednik": false,
          "Napomena": "Kooperativni shooter s taktičkim izazovima i prijateljskim vatrom koji potiče suradnju igrača."
        },
        {
          "Naziv_igre": "Stellar Blade",
          "Developer": "Shift Up",
          "Izdavač": "Sony Interactive Entertainment",
          "Zemlja_podrijetla": "South Korea",
          "Platforme": ["PlayStation 5"],
          "Žanr": ["Action-adventure", "Hack-and-slash"],
          "Prosječna_ocjena_(Metacritic)": 85,
          "Pobjednik": false,
          "Napomena": "Akcijska avantura s fokusom na preciznu borbu i vizualno impresivne animacije."
        },
        {
          "Naziv_igre": "Warhammer 40,000: Space Marine 2",
          "Developer": "Saber Interactive",
          "Izdavač": "Focus Entertainment",
          "Zemlja_podrijetla": "USA",
          "Platforme": ["PlayStation 5", "Windows", "Xbox Series X/S"],
          "Žanr": ["Hack-and-slash", "Shooter", "Third-person"],
          "Prosječna_ocjena_(Metacritic)": 84,
          "Pobjednik": false,
          "Napomena": "Nastavak klasične akcijske igre s intenzivnim borbama protiv hordâ neprijatelja."
        }
      ]
    },
    {
      "Kategorija": "Best Art Direction",
      "Opis": "Nagrada za izvrsnost u vizualnom dizajnu i umjetničkoj prezentaciji igre.",
      "Nominirane_igre": [
        {
          "Naziv_igre": "Astro Bot",
          "Developer": "Team Asobi",
          "Izdavač": "Sony Interactive Entertainment",
          "Zemlja_podrijetla": "Japan",
          "Platforme": ["PlayStation 5"],
          "Žanr": ["Action-adventure", "Platformer"],
          "Prosječna_ocjena_(Metacritic)": 91,
          "Pobjednik": false,
          "Napomena": "Šarmantna 3D avantura s preciznom kontrolom i kreativnim korištenjem DualSense mogućnosti."
        },
        {
          "Naziv_igre": "Black Myth: Wukong",
          "Developer": "Game Science",
          "Izdavač": "Game Science",
          "Zemlja_podrijetla": "China",
          "Platforme": ["PlayStation 5", "Windows", "Xbox Series X/S"],
          "Žanr": ["Action", "Role-playing"],
          "Prosječna_ocjena_(Metacritic)": 90,
          "Pobjednik": false,
          "Napomena": "Akcijski RPG inspiriran kineskom mitologijom s impresivnim tehničkim postignućima."
        },
        {
          "Naziv_igre": "Elden Ring: Shadow of the Erdtree",
          "Developer": "FromSoftware",
          "Izdavač": "Bandai Namco Entertainment",
          "Zemlja_podrijetla": "Japan",
          "Platforme": [
            "PlayStation 4",
            "PlayStation 5",
            "Windows",
            "Xbox One",
            "Xbox Series X/S"
          ],
          "Žanr": ["Action", "Role-playing"],
          "Prosječna_ocjena_(Metacritic)": 94,
          "Pobjednik": false,
          "Napomena": "Velika ekspanzija nagrađivane igre, poznata po dubokom dizajnu svijeta i izazovnim borbama."
        },
        {
          "Naziv_igre": "Metaphor: ReFantazio",
          "Developer": "Atlus",
          "Izdavač": "Sega",
          "Zemlja_podrijetla": "Japan",
          "Platforme": [
            "PlayStation 4",
            "PlayStation 5",
            "Windows",
            "Xbox Series X/S"
          ],
          "Žanr": ["Role-playing"],
          "Prosječna_ocjena_(Metacritic)": 88,
          "Pobjednik": true,
          "Napomena": "Pohvaljena zbog dubine svijeta, političke alegorije i složenog RPG sustava."
        },
        {
          "Naziv_igre": "Neva",
          "Developer": "Nomada Studio",
          "Izdavač": "Devolver Digital",
          "Zemlja_podrijetla": "Spain",
          "Platforme": [
            "Nintendo Switch",
            "PlayStation 5",
            "Windows",
            "Xbox Series X/S"
          ],
          "Žanr": ["Platformer", "Puzzle"],
          "Prosječna_ocjena_(Metacritic)": 87,
          "Pobjednik": false,
          "Napomena": "Umjetnički platformer koji istražuje teme gubitka i emocionalne povezanosti."
        }
      ]
    },
    {
      "Kategorija": "Best Audio Design",
      "Opis": "Prepoznaje izvrsnost u dizajnu zvuka, glasovnim efektima i miksu.",
      "Nominirane_igre": [
        {
          "Naziv_igre": "Astro Bot",
          "Developer": "Team Asobi",
          "Izdavač": "Sony Interactive Entertainment",
          "Zemlja_podrijetla": "Japan",
          "Platforme": ["PlayStation 5"],
          "Žanr": ["Action-adventure", "Platformer"],
          "Prosječna_ocjena_(Metacritic)": 91,
          "Pobjednik": false,
          "Napomena": "Šarmantna 3D avantura s preciznom kontrolom i kreativnim korištenjem DualSense mogućnosti."
        },
        {
          "Naziv_igre": "Call of Duty: Black Ops 6",
          "Developer": "Treyarch",
          "Izdavač": "Activision",
          "Zemlja_podrijetla": "USA",
          "Platforme": [
            "PlayStation 4",
            "PlayStation 5",
            "Windows",
            "Xbox One",
            "Xbox Series X/S"
          ],
          "Žanr": ["First-person", "Shooter"],
          "Prosječna_ocjena_(Metacritic)": 83,
          "Pobjednik": false,
          "Napomena": "Nastavak popularnog FPS serijala s fokusom na dinamičnu kampanju i višestruki multiplayer mod."
        },
        {
          "Naziv_igre": "Final Fantasy VII Rebirth",
          "Developer": "Square Enix",
          "Izdavač": "Square Enix",
          "Zemlja_podrijetla": "Japan",
          "Platforme": ["PlayStation 5"],
          "Žanr": ["Action", "Role-playing"],
          "Prosječna_ocjena_(Metacritic)": 92,
          "Pobjednik": false,
          "Napomena": "Nastavlja reinterpretaciju originalnog FF7 s modernim borbenim sustavom i vizualima."
        },
        {
          "Naziv_igre": "Senua's Saga: Hellblade II",
          "Developer": "Ninja Theory",
          "Izdavač": "Xbox Game Studios",
          "Zemlja_podrijetla": "UK",
          "Platforme": ["Windows", "Xbox Series X/S"],
          "Žanr": ["Action-adventure", "Hack-and-slash"],
          "Prosječna_ocjena_(Metacritic)": 82,
          "Pobjednik": true,
          "Napomena": "Psihološka, kinematografska prezentacija perspektive Senuae."
        },
        {
          "Naziv_igre": "Silent Hill 2",
          "Developer": "Bloober Team",
          "Izdavač": "Konami",
          "Zemlja_podrijetla": "Poland",
          "Platforme": ["PlayStation 5", "Windows"],
          "Žanr": ["Survival-horror"],
          "Prosječna_ocjena_(Metacritic)": 81,
          "Pobjednik": false,
          "Napomena": "Remake klasika horor žanra s moderniziranom grafikom i atmosferom vjernom originalu."
        }
      ]
    },
    {
      "Kategorija": "Best Esports Game",
      "Opis": "Najbolja kompetitivna igra s aktivnom esports scenom.",
      "Nominirane_igre": [
        {
          "Naziv_igre": "Counter-Strike 2",
          "Developer": "Valve",
          "Izdavač": "Valve",
          "Zemlja_podrijetla": "USA",
          "Platforme": ["macOS", "Windows"],
          "Žanr": ["First-person", "Shooter", "Tactical"],
          "Prosječna_ocjena_(Metacritic)": 80,
          "Pobjednik": false,
          "Napomena": "Nasljednik legendarne CS:GO igre, s moderniziranim motorom i natjecateljskim značajkama."
        },
        {
          "Naziv_igre": "Dota 2",
          "Developer": "Valve",
          "Izdavač": "Valve",
          "Zemlja_podrijetla": "USA",
          "Platforme": ["Linux", "macOS", "Windows"],
          "Žanr": ["MOBA"],
          "Prosječna_ocjena_(Metacritic)": 90,
          "Pobjednik": false,
          "Napomena": "Kultna MOBA igra s najvećim esport nagradnim fondom i aktivnom zajednicom."
        },
        {
          "Naziv_igre": "League of Legends",
          "Developer": "Riot Games",
          "Izdavač": "Riot Games",
          "Zemlja_podrijetla": "USA",
          "Platforme": ["macOS", "Windows"],
          "Žanr": ["MOBA"],
          "Prosječna_ocjena_(Metacritic)": 78,